{
  "schemaVersion": "1.0.0",
  "review": {
    "title": "Computational Review Template",
    "reviewType": "computational-literature-review",
    "language": "en",
    "license": "MIT"
  },
  "repository": {
    "url": "https://github.com/Neuronautix/ComputationalReviewTemplate_trust-knowledge"
  },
  "artifacts": {
    "claims": "knowledge/oratlas/claims.jsonl",
    "citations": "knowledge/oratlas/citations.jsonl",
    "relations": "knowledge/oratlas/relations.jsonl",
    "provenance": "knowledge/oratlas/source-native-trust.json"
  }
}
